{
  "schemaVersion": 1,
  "facitVersion": "self",
  "generatedAt": "2026-06-30T00:00:00Z",
  "entries": [
    {
      "acId": "E1.S1.A1",
      "status": "implemented",
      "evidence": [
        {
          "kind": "code",
          "ref": "tools/facit/facit.py:61-159",
          "note": "compile discovers + schema-validates a facit root and reports nodes/hash."
        },
        {
          "kind": "test",
          "ref": "test_compile_cli_spec",
          "note": "proving test"
        }
      ],
      "notes": "compile discovers + schema-validates a facit root and reports nodes/hash.",
      "proof": {
        "tests": [
          "test_compile_cli_spec"
        ],
        "coveredFiles": []
      }
    },
    {
      "acId": "E1.S1.A2",
      "status": "implemented",
      "evidence": [
        {
          "kind": "code",
          "ref": "tools/facit/facit.py:96-159",
          "note": "globally-qualified ids + facit count + stable hash — not pinned by a dedicated test."
        },
        {
          "kind": "test",
          "ref": "test_compile_reports_counts_and_stable_hash",
          "note": "proving test"
        }
      ],
      "notes": "globally-qualified ids + facit count + stable hash — not pinned by a dedicated test.",
      "proof": {
        "tests": [
          "test_compile_reports_counts_and_stable_hash"
        ],
        "coveredFiles": []
      }
    },
    {
      "acId": "E1.S1.A3",
      "status": "implemented",
      "evidence": [
        {
          "kind": "code",
          "ref": "tools/facit/facit.py",
          "note": "exit-code contract not pinned by a dedicated compile-error test."
        },
        {
          "kind": "test",
          "ref": "test_compile_exit_codes_valid_zero_invalid_nonzero",
          "note": "proving test"
        }
      ],
      "notes": "exit-code contract not pinned by a dedicated compile-error test.",
      "proof": {
        "tests": [
          "test_compile_exit_codes_valid_zero_invalid_nonzero"
        ],
        "coveredFiles": []
      }
    },
    {
      "acId": "E1.S2.A1",
      "status": "implemented",
      "evidence": [
        {
          "kind": "code",
          "ref": "tools/facit/facit.py",
          "note": "validate reports VALID + node count/hash and exits zero on a valid root."
        },
        {
          "kind": "test",
          "ref": "test_validate_cli_spec",
          "note": "proving test"
        }
      ],
      "notes": "validate reports VALID + node count/hash and exits zero on a valid root.",
      "proof": {
        "tests": [
          "test_validate_cli_spec"
        ],
        "coveredFiles": []
      }
    },
    {
      "acId": "E1.S2.A2",
      "status": "implemented",
      "evidence": [
        {
          "kind": "code",
          "ref": "tools/facit/facit.py",
          "note": "validate-on-invalid (prints errors + non-zero) not pinned by a dedicated test."
        },
        {
          "kind": "test",
          "ref": "test_validate_invalid_prints_errors_nonzero",
          "note": "proving test"
        }
      ],
      "notes": "validate-on-invalid (prints errors + non-zero) not pinned by a dedicated test.",
      "proof": {
        "tests": [
          "test_validate_invalid_prints_errors_nonzero"
        ],
        "coveredFiles": []
      }
    },
    {
      "acId": "E1.S3.A1",
      "status": "implemented",
      "evidence": [
        {
          "kind": "code",
          "ref": "tools/facit/facit.py",
          "note": "duplicate-id / parent-bound integrity not pinned by a dedicated test."
        },
        {
          "kind": "test",
          "ref": "test_compile_flags_duplicate_id",
          "note": "proving test"
        },
        {
          "kind": "test",
          "ref": "test_compile_flags_non_parent_bound_ac",
          "note": "proving test"
        }
      ],
      "notes": "duplicate-id / parent-bound integrity not pinned by a dedicated test.",
      "proof": {
        "tests": [
          "test_compile_flags_duplicate_id",
          "test_compile_flags_non_parent_bound_ac"
        ],
        "coveredFiles": []
      }
    },
    {
      "acId": "E1.S3.A2",
      "status": "implemented",
      "evidence": [
        {
          "kind": "code",
          "ref": "tools/facit/facit.py",
          "note": "extends-warning not pinned."
        },
        {
          "kind": "test",
          "ref": "test_compile_warns_unknown_extends",
          "note": "proving test"
        }
      ],
      "notes": "extends-warning not pinned.",
      "proof": {
        "tests": [
          "test_compile_warns_unknown_extends"
        ],
        "coveredFiles": []
      }
    },
    {
      "acId": "E1.S3.A3",
      "status": "implemented",
      "evidence": [
        {
          "kind": "code",
          "ref": "tools/facit/facit.py",
          "note": "recommended-utility-warning not pinned."
        },
        {
          "kind": "test",
          "ref": "test_compile_warns_unknown_recommended_utility",
          "note": "proving test"
        }
      ],
      "notes": "recommended-utility-warning not pinned.",
      "proof": {
        "tests": [
          "test_compile_warns_unknown_recommended_utility"
        ],
        "coveredFiles": []
      }
    },
    {
      "acId": "E1.S4.A1",
      "status": "implemented",
      "evidence": [
        {
          "kind": "code",
          "ref": "tools/facit/facit.py",
          "note": "default root = platform facit when none given."
        },
        {
          "kind": "test",
          "ref": "test_compile_default_root",
          "note": "proving test"
        }
      ],
      "notes": "default root = platform facit when none given.",
      "proof": {
        "tests": [
          "test_compile_default_root"
        ],
        "coveredFiles": []
      }
    },
    {
      "acId": "E1.S4.A2",
      "status": "implemented",
      "evidence": [
        {
          "kind": "code",
          "ref": "tools/facit/facit.py",
          "note": "identical behaviour across default vs explicit --root (same hash + node count)."
        },
        {
          "kind": "test",
          "ref": "test_compile_explicit_docs_root",
          "note": "proving test"
        }
      ],
      "notes": "identical behaviour across default vs explicit --root (same hash + node count).",
      "proof": {
        "tests": [
          "test_compile_explicit_docs_root"
        ],
        "coveredFiles": []
      }
    },
    {
      "acId": "E1.S4.A3",
      "status": "implemented",
      "evidence": [
        {
          "kind": "code",
          "ref": "tools/facit/facit.py",
          "note": "dogfood: compile + validate succeed on the CLI's own facit."
        },
        {
          "kind": "test",
          "ref": "test_compile_cli_spec",
          "note": "proving test"
        },
        {
          "kind": "test",
          "ref": "test_validate_cli_spec",
          "note": "proving test"
        }
      ],
      "notes": "dogfood: compile + validate succeed on the CLI's own facit.",
      "proof": {
        "tests": [
          "test_compile_cli_spec",
          "test_validate_cli_spec"
        ],
        "coveredFiles": []
      }
    },
    {
      "acId": "E1.S5.A1",
      "status": "implemented",
      "evidence": [
        {
          "kind": "code",
          "ref": "tools/facit/facit.py:176-200",
          "note": "lock writes per-node hash/status/tests — exercised but not asserted structurally."
        },
        {
          "kind": "test",
          "ref": "test_lock_writes_per_node_hash_status_tests_and_metadata",
          "note": "proving test"
        }
      ],
      "notes": "lock writes per-node hash/status/tests — exercised but not asserted structurally.",
      "proof": {
        "tests": [
          "test_lock_writes_per_node_hash_status_tests_and_metadata"
        ],
        "coveredFiles": []
      }
    },
    {
      "acId": "E1.S5.A2",
      "status": "implemented",
      "evidence": [
        {
          "kind": "code",
          "ref": "tools/facit/facit.py:176-200",
          "note": "lock refuses + reports on a schema-invalid facit."
        },
        {
          "kind": "test",
          "ref": "test_lock_refuses_invalid_facit",
          "note": "proving test"
        }
      ],
      "notes": "lock refuses + reports on a schema-invalid facit.",
      "proof": {
        "tests": [
          "test_lock_refuses_invalid_facit"
        ],
        "coveredFiles": []
      }
    },
    {
      "acId": "E1.S5.A3",
      "status": "implemented",
      "evidence": [
        {
          "kind": "code",
          "ref": "tools/facit/facit.py:176-260",
          "note": "re-lock carries proven forward only for unchanged nodes; changed node resets."
        },
        {
          "kind": "test",
          "ref": "test_relock_carries_proven_forward",
          "note": "proving test"
        }
      ],
      "notes": "re-lock carries proven forward only for unchanged nodes; changed node resets.",
      "proof": {
        "tests": [
          "test_relock_carries_proven_forward",
          "test_relock_preserves_testsources"
        ],
        "coveredFiles": []
      }
    },
    {
      "acId": "E1.S6.A1",
      "status": "implemented",
      "evidence": [
        {
          "kind": "code",
          "ref": "tools/facit/facit.py",
          "note": "added/removed not pinned (only changed is)."
        },
        {
          "kind": "test",
          "ref": "test_diff_lists_added_changed_and_removed",
          "note": "proving test"
        }
      ],
      "notes": "added/removed not pinned (only changed is).",
      "proof": {
        "tests": [
          "test_diff_lists_added_changed_and_removed"
        ],
        "coveredFiles": []
      }
    },
    {
      "acId": "E1.S6.A2",
      "status": "implemented",
      "evidence": [
        {
          "kind": "code",
          "ref": "tools/facit/facit.py",